not_bio_related	name	summary	url
 	extract_fullseq	extract_fullseq is part of BMTagger aka Best Match Tagger, for removing human reads from metagenomics datasets	ftp://ftp.ncbi.nlm.nih.gov/pub/agarwala/bmtagger/
 	extract_genome_region	Given a CSV file of variable information defining the regions of interest, return a file that contains a fasta-formatted representation of these regions.	https://github.com/xguse/extract-genome-region
 	extractpirs	A phase informative read (PIR) is a sequencing read that span at least 2 heterozyguous sites. In the following, we require first that the sequence data is stored in BAM files and second that the genotype data to be phased is in VCF format. We developed a small tool, extractPIRs, to extract the PIRs from BAM files that relies on the samtools API for efficiency	https://mathgen.stats.ox.ac.uk/genetics_software/shapeit/shapeit.html
 	fadapa	FAstqc DAta PArser - A minimal parser to parse FastQC output data	https://github.com/fadapa/fadapa
 	fann	Fast Artificial Neural Network Library	http://leenissen.dk/fann/wp/
 	fast5	A C++ header-only library for reading Oxford Nanopore Fast5 files.	https://github.com/mateidavid/fast5
 	fasta3	The FASTA package - protein and DNA sequence similarity searching and alignment programs	http://faculty.virginia.edu/wrpearson/fasta
 	fastahack	fastahack --- *fast* FASTA file indexing, subsequence and sequence extraction	https://github.com/ekg/fastahack
 	fastaindex	FastA indexing and sequence retrival.	https://github.com/lpryszcz/FastaIndex
x	fastdtw	Dynamic Time Warping (DTW) algorithm with an O(N) time and memory complexity	https://github.com/slaypni/fastdtw
 	fastlmm	Fast GWAS	http://research.microsoft.com/en-us/um/redmond/projects/mscompbio/fastlmm/
 	fastme	a comprehensive, accurate and fast distance-based phylogeny inference program.	http://www.atgc-montpellier.fr/fastme/binaries.php
 	fastool	A simple and quick tool to read huge FastQ and FastA files (both normal and gzipped) and manipulate them.	https://github.com/fstrozzi/Fastool
 	fastq-and-furious	Fast handling of FASTQ files	https://github.com/lgautier/fastq-and-furious
 	fastq-join	"Similar to audy's stitch program, but in C, more efficient and supports some automatic benchmarking and tuning. It uses the same ""squared distance for anchored alignment"" as other tools."	https://github.com/brwnj/fastq-join
 	fastq-multx	Demultiplexes a fastq. Capable of auto-determining barcode id's based on a master set fields. Keeps multiple reads in-sync during demultiplexing. Can verify that the reads are in-sync as well, and fail if they're not.	https://github.com/brwnj/fastq-multx
 	fastq-screen	FastQ Screen allows you to screen a library of sequences in FastQ format against a set of sequence databases so you can see if the composition of the library matches with what you expect	http://www.bioinformatics.babraham.ac.uk/projects/fastq_screen/
 	fastqc	A quality control tool for high throughput sequence data.	http://www.bioinformatics.babraham.ac.uk/projects/fastqc/
 	fasttree	FastTree infers approximately-maximum-likelihood phylogenetic trees from alignments of nucleotide or protein sequences	http://www.microbesonline.org/fasttree/
 	fastuniq	FastUniq, A Fast De Novo Duplicates Removal Tool for Paired Short Reads	https://sourceforge.net/projects/fastuniq/
 	fastx_toolkit	The FASTX-Toolkit is a collection of command line tools for Short-Reads FASTA/FASTQ files preprocessing.Next-Generation sequencing machines usually produce FASTA or FASTQ files, containing multiple short-reads sequences (possibly with quality information).The main processing of such FASTA/FASTQ files is mapping (aka aligning) the sequences to reference genomes or other databases using specialized programs. Example of such mapping programs are: Blat, SHRiMP, LastZ, MAQ and many many others.However, it is sometimes more productive to preprocess the FASTA/FASTQ files before mapping the sequences to the genome - manipulating the sequences to produce better mapping results.The FASTX-Toolkit tools perform some of these preprocessing tasks.	https://github.com/agordon/fastx_toolkit
 	fcp	Homology- and composition-based classifiers for assigning a taxonomic attribution to metagenomic fragments.	https://github.com/dparks1134/FragmentClassificationPackage
 	fermi	A WGS de novo assembler based on the FMD-index for large genomes	https://github.com/lh3/fermi
 	fermi2	Fermi2 focuses on the exploration of FMD-index as a graph.	https://github.com/lh3/fermi2
 	fermikit	FermiKit is a de novo assembly based variant calling pipeline for deep Illumina resequencing data.	https://github.com/lh3/fermikit
 	fgbio	A set of tools for working with genomic and high throughput sequencing data, including UMIs	https://github.com/fulcrumgenomics/fgbio
x	ficus	Ficus provides a context manager for matplotlib figures.	https://github.com/camillescott/ficus
 	fido	A method for protein identification in MS/MS proteomics. Think of it like a protein delivery dog. You bring it the scored matches between peptides and spectra, and it fetches a list of proteins ranked by posterior probability by doing clever tricks.	https://noble.gs.washington.edu/proj/fido/
 	fiji	"Fiji is an image processing packagea ""batteries-included"" distribution of ImageJ, bundling a lot of plugins which facilitate scientific image analysis."	http://fiji.sc
x	filechunkio	FileChunkIO represents a chunk of an OS-level file containing bytes data	http://bitbucket.org/fabian/filechunkio
 	filtlong	Filtlong is a tool for filtering long reads. It can take a set of long reads and produce a smaller, better subset. It uses both read length (longer is better) and read identity (higher is better) when choosing which reads pass the filter.	https://github.com/rrwick/Filtlong
 	find_differential_primers	Scripts to aid the design of differential primers for diagnostic PCR.	https://github.com/widdowquinn/find_differential_primers
x	fisher	Fast Fisher's Exact Test	http://github.com/brentp/fishers_exact_test
 	fishtaco	FishTaco: a metagenomic computational framework, aiming to identify the taxa that are driving functional shifts in microbiomes.	http://omanor.github.io/fishtaco/
x	fitter	A tool to fit data to many distributions and best one(s)	
 	flaimapper	FlaiMapper: Detecting small ncRNA derived fragments in small RNA-Seq data	https://github.com/yhoogstrate/flaimapper/
 	flash	Merge mates from fragments that are shorter than twice the read length	https://ccb.jhu.edu/software/FLASH/
x	flask-admin	Simple and extensible admin interface framework for Flask	https://github.com/flask-admin/flask-admin/
x	flask-bootstrap	An extension that includes Bootstrap in your project, without any boilerplate code.	http://github.com/mbr/flask-bootstrap
x	flask-bower	An extension to manage and serve your javascript assets with bower	http://github.com/lobeck/flask-bower
x	flask-markdown	Small extension to make using markdown easy	http://github.com/dcolish/flask-markdown
x	flask-nav	Easily create navigation for Flask applications.	http://github.com/mbr/flask-nav
x	flask-potion	Powerful REST API framework for Flask and SQLAlchemy	http://potion.readthedocs.org/en/latest/
 	flexbar	Flexible barcode and adapter removal	https://github.com/seqan/flexbar
 	flock		https://sourceforge.net/projects/immportflock/
 	flux-simulator	Tool for modeling RNA-Seq experiments in silico	http://sammeth.net/confluence/display/SIM/Home
 	footprint	This is a pipeline to find transcription factor footprints in ATAC-seq or DNase-seq data.	https://ohlerlab.mdc-berlin.de/software/Reproducible_footprinting_139/
x	forked-path	An object oriented file path module	http://github.com/Singletoned/forked-path
 	fqtools	An efficient FASTQ manipulation suite.	https://github.com/alastair-droop/fqtools
 	fraggenescan	FragGeneScan is an application for finding (fragmented) genes in short reads.	https://sourceforge.net/projects/fraggenescan/
 	frc	Computes FRC from SAM/BAM file and not from afg files	https://github.com/vezzi/FRC_align
 	freebayes	Bayesian haplotype-based polymorphism discovery and genotyping	https://github.com/ekg/freebayes
 	fsnviz	Tool for plotting gene fusion events detected by various tools using Circos.	https://github.com/bow/fsnviz
x	ftputil	High-level FTP client library (virtual file system and more)	http://ftputil.sschwarzer.net/
 	fuma	FuMa: reporting overlap in RNA-seq detected fusion genes	https://github.com/yhoogstrate/fuma/
x	fusepy	Simple ctypes bindings for FUSE	http://github.com/terencehonles/fusepy
 	fwdpp	A C++ template library for forward-time population genetic simulation. 	https://www.github.com/molpopgen/fwdpp
 	fwdpy	Forward-time population genetic simulation in Python.	http://pypi.python.org/pypi/fwdpy
 	fwdpy11	Forward-time population genetic simulation in Python.	http://pypi.python.org/pypi/fwdpy11
 	gadem	A Genetic Algorithm Guided Formation of Spaced Dyads Coupled with an EM Algorithm for Motif Discovery	https://www.niehs.nih.gov/research/resources/software/biostatistics/gadem/index.cfm
 	galaxy-lib	Subset of Galaxy (http://galaxyproject.org/) core code base designed to be used a library.	https://github.com/galaxyproject/galaxy-lib
 	galaxy-ops	Galaxy interval operations	https://github.com/galaxyproject/gops
 	galaxy_sequence_utils	Sequence Utilities from the Galaxy project	https://github.com/galaxyproject/sequence_utils
 	gap2seq	Gap2Seq is a tool for filling gaps between contigs in genome assemblies.	https://www.cs.helsinki.fi/u/lmsalmel/Gap2Seq/
 	garnet	UNKNOWN	https://github.com/fraenkel-lab/GarNet
 	gat	Genomic Association Tester	https://github.com/AndreasHeger/gat
 	gatk	The full Genome Analysis Toolkit (GATK) framework, license restricted.	https://www.broadinstitute.org/gatk/
 	gatk-framework	The core MIT-licensed Genome Analysis Toolkit (GATK) framework, free for all uses	https://github.com/chapmanb/gatk
 	gatk4	Genome Analysis Toolkit (GATK4)	https://www.broadinstitute.org/gatk/
x	gawk	The awk utility interprets a special-purpose programming language that makes it possible to handle simple data-reformatting jobs with just a few lines of code.	https://www.gnu.org/software/gawk/
 	gb_taxonomy_tools	These are four simple utilities which perform certain manipulations and  visualization tasks on GenBank taxonomic information.	https://github.com/spond/gb_taxonomy_tools
 	gclib	Genomic C libraries by Geo Pertea	https://github.com/gpertea/gclib
x	gcs-oauth2-boto-plugin	Auth plugin allowing use the use of OAuth 2.0 credentials for Google Cloud Storage in the Boto library.	https://developers.google.com/storage/docs/gspythonlibrary
x	gdal	Geospatial Data Abstraction Library	http://gdal.org
x	gdk-pixbuf	The GdkPixbuf Structure  Information that describes an image.	https://developer.gnome.org/gdk-pixbuf/
 	gdsctools	Set of tools and pipelines to analyse GDSC data (cancerrxgene.org)	
 	gecode	Generic constraint development environment	http://www.gecode.org/
 	gemini	a lightweight db framework for disease and population genetics.	https://github.com/arq5x/gemini
 	genblasta	genBlast is a program suite, consisting of two programs: genBlastA and genBlastG. genBlastA parses local alignments, or high-scoring segment pairs (HSPs) produced by local sequence alignment programs such as BLAST and WU-BLAST and identify groups of HSPs.	http://genome.sfu.ca/genblast/download.html
 	genblastg	genBlast is a program suite, consisting of two programs: genBlastA and genBlastG. genBlastA parses local alignments, or high-scoring segment pairs (HSPs) produced by local sequence alignment programs such as BLAST and WU-BLAST and identify groups of HSPs.	http://genome.sfu.ca/genblast/download.html
 	geneimpacts	prioritize effects of variant annotations from VEP, SnpEff, et al.	https://github.com/brentp/geneimpacts
 	genepop	The Genepop population genetics package.	http://kimura.univ-montp2.fr/~rousset/Genepop.htm
 	genesplicer	GeneSplicer : A computational method for splice site prediction	http://www.cs.jhu.edu/~genomics/GeneSplicer
 	genologics	Python interface to the GenoLogics LIMS (Laboratory Information Management System) server via its REST API.	https://github.com/scilifelab/genologics
 	genomebaser	GenomeBaser manages complete (bacterial) genomes from NCBI	http://github.com/mscook/GenomeBaser
 	genomedata	tools for accessing large amounts of genomic data	http://genomedata.hoffmanlab.org/
 	genomepy	Easy install of genomes.	https://github.com/simonvh/genomepy
 	genometools	GenomeTools: Scripts and Classes For Working With Genomic Data.	https://github.com/flo-compbio/genometools
 	genometools-genometools	GenomeTools genome analysis system.	http://genometools.org/
 	genomicassertions	A package to test common files in genomics (.vcf.gz, .bam)	https://github.com/dakl/genomicassertions
 	genomicconsensus		https://github.com/PacificBiosciences/GenomicConsensus
 	genonets	Framework for creating and analyzing genotype networks from data.	https://github.com/fkhalid/genonets
 	geodl	Dowload FASTQ files from GEO-NCBI with ease	https://github.com/jduc/geoDL
x	gevent	Coroutine-based network library	http://www.gevent.org/
 	gfapy	Library for handling data in the GFA1 and GFA2 formats	https://github.com/ggonnella/gfapy
 	gff3toembl	Submitting annotated genomes to EMBL is a very difficult and time consuming process. This software converts GFF3 files from the most commonly use prokaryote annotation tool Prokka into a format that is suitable for submission to EMBL. It has been used to prepare more than 30% of all annotated genomes in EMBL/GenBank.	https://github.com/sanger-pathogens/gff3toembl/
 	gffcompare	GffCompare by Geo Pertea	https://github.com/gpertea/gffcompare
 	gffread	GFF/GTF utility providing format conversions, region filtering, FASTA sequence extraction and more.	http://ccb.jhu.edu/software/stringtie/gff.shtml
 	gffutils	Work with GFF and GTF files in a flexible database framework	https://github.com/daler/gffutils
 	gfinisher	GFinisher is an application tools for refinement and finalization of prokaryotic genomes assemblies using the bias of GC Skew to identify assembly errors and organizes the contigs/scaffolds with genomes references.	https://sourceforge.net/projects/gfinisher/
 	gfold	Find differentially expressed genes from RNA-seq data with few replicates using generalized fold changes.	http://compbio.tongji.edu.cn/~fengjx/GFOLD/gfold.html
x	ggplot	An extremely un-pythonic package for doing exactly what ggplot2 does	https://github.com/yhat/ggplot/
x	ghc	GHC is a state-of-the-art, open source, compiler and interactive environment for the functional language Haskell.	https://www.haskell.org/ghc/
x	ghmm	General Hidden Markov Model library (GHMM) is a freely available C library implementing efficient data structures and algorithms for basic and extended HMMs with discrete and continous emissions	http://ghmm.org/
x	ghostscript	An interpreter for the PostScript language and for PDF.	http://ghostscript.com/
 	gimmemotifs	Motif prediction pipeline and various motif-related tools	https://github.com/simonvh/gimmemotifs
 	glimmer	Glimmer is a system for finding genes in microbial DNA	https://ccb.jhu.edu/software/glimmer/index.shtml
 	glimmerhmm	GlimmerHMM is a gene finder based on a Generalized Hidden Markov Model (GHMM)	https://ccb.jhu.edu/software/glimmerhmm/
x	glob2	Version of the glob module that can capture patterns and supports recursive wildcards	http://github.com/miracle2k/python-glob2/
x	glpk	GNU Linear Programming Kit	https://www.gnu.org/software/glpk/
 	gmap	Genomic mapping and alignment program for mRNA and EST sequences	http://research-pub.gene.com/gmap/
 	gmtk	A publicly available toolkit for rapidly prototyping statistical models using dynamic graphical models (DGMs) and dynamic Bayesian networks (DBNs)	http://melodi.ee.washington.edu/gmtk/
x	gnu-getopt	Command-line option parsing library	http://software.frodo.looijaard.name/getopt/
x	gnu-wget	Retrieve files using HTTP, HTTPS and FTP	http://www.gnu.org/software/wget/
x	gnuplot-py	A Python interface to the gnuplot plotting program.	http://gnuplot-py.sourceforge.net
 	goatools	Python scripts to find enrichment of GO terms	https://github.com/tanghaibao/goatools
x	gocr	GOCR is an OCR (Optical Character Recognition) program	http://jocr.sourceforge.net/
 	goleft	goleft is a collection of bioinformatics tools distributed under MIT license in a single static binary	https://github.com/brentp/goleft
x	google-api-python-client		https://github.com/google/google-api-python-client/
x	google-cloud-sdk	Command-line interface for Google Cloud Platform products and services	https://cloud.google.com/sdk/
x	google-sparsehash	Several hash-map implementations.	https://github.com/sparsehash/sparsehash
 	gottcha	Genomic Origin Through Taxonomic CHAllenge (GOTTCHA)	https://github.com/LANL-Bioinformatics/GOTTCHA
 	gprofiler-official	Functional enrichment analysis and more via the g:Profiler toolkit	http://biit.cs.ut.ee/gprofiler
 	gqt	GQT is a genotype query interface.	https://github.com/ryanlayer/gqt
 	grabix	a wee tool for random access into BGZF files.	https://github.com/arq5x/grabix
 	graftm	GraftM is a pipeline used for identifying and classifying marker gene reads from metagenomic datasets	http://geronimp.github.io/graftM
 	graph_embed	Compute a 2D embedding of a data matrix given supervised class information.	https://github.com/fabriziocosta/GraphEmbed
 	graphclust-wrappers	The set of individual perl wrappers extracted from GraphClust pipeline	http://www.bioinf.uni-freiburg.de/Software/GraphClust/
x	graphicsmagick	GraphicsMagick is the swiss army knife of image processing	http://www.graphicsmagick.org/
 	graphlan	GraPhlAn is a software tool for producing high-quality circular representations of taxonomic and phylogenetic trees. It focuses on concise, integrative, informative, and publication-ready representations of phylogenetically- and taxonomically-driven investigation.	https://bitbucket.org/nsegata/graphlan/wiki/Home
x	graphlite	embedded graph datastore	https://github.com/eugene-eeo/graphlite
 	graphmap	A highly sensitive and accurate mapper for long, error-prone reads.	https://github.com/isovic/graphmap
 	graphprot	GraphProt is a tool for modelling binding preferences of RNA-binding proteins from high-throughput experiments such as CLIP-seq and RNAcompete.	https://github.com/dmaticzka/graphprot
x	grep	Grep searches one or more input files for lines containing a match to a specified pattern	https://www.gnu.org/software/grep/
 	gridss	GRIDSS: a Genomic Rearrangement IDentification Software Suite	https://github.com/PapenfussLab/gridss
 	gromacs	GROMACS is a versatile package to perform molecular dynamics.	http://www.gromacs.org/
 	group_humann2_uniref_abundances_to_go	Group abundances of UniRef50 gene families obtained with HUMAnN2 to Gene Ontology (GO) slim terms with relative abundances	https://github.com/ASaiM/group_humann2_uniref_abundances_to_GO
 	gseapy	Gene Set Enrichment Analysis in Python	https://github.com/BioNinja/gseapy
 	gsort	sort genomic files according to a genomefile	https://github.com/brentp/gsort
 	gtf_to_genes	Fast GTF parser	http://code.google.com/p/gtf-to-genes/
 	gubbins	Rapid phylogenetic analysis of large samples of recombinant bacterial whole genome sequences using Gubbins.	https://github.com/sanger-pathogens/gubbins
 	guidescan	Tools to create and interface genome-wide CRISPR guideRNA databases	https://bitbucket.org/arp2012/guidescan_public
 	gustaf	Gustaf is a tool primarily designed for multi-split mapping of sequencing reads.	https://github.com/seqan/seqan/tree/master/apps/gustaf/README.rst
 	gvcf-regions	Convert a gVCF file in multiple formats into a BED file of callable regions	https://github.com/lijiayong/gvcf_regions
 	gvcftools	a set of utilities to help create and analyze Genome VCF (gVCF) files.	https://sites.google.com/site/gvcftools/home
 	hap.py	Haplotype VCF comparison tools	https://github.com/sequencing/hap.py
 	hapbin	hapbin is a collection of tools for efficiently calculating Extended Haplotype Homozygosity (EHH), the Integrated Haplotype Score (iHS) and the Cross Population Extended Haplotype Homozogysity (XP-EHH) statistic.	https://github.com/evotools/hapbin
 	hapflk	hapflk is a software implementing the hapFLK and FLK tests for the detection of selection signatures based on multiple population genotyping data.	https://forge-dga.jouy.inra.fr/projects/hapflk
 	hardklor	Analyze mass spectra	https://github.com/mhoopmann/hardklor
 	haystack_bio	Epigenetic Variability and Transcription Factor Motifs Analysis Pipeline	https://github.com/pinellolab/haystack_bio
 	hclust2	Hclust2 is a handy tool for plotting heat-maps with several useful options to produce high quality figures that can be used in publication.	https://bitbucket.org/nsegata/hclust2
x	hcluster_sg	A tool for hierarchically clustering on a sparse graph	https://github.com/douglasgscofield/hcluster
 	helperlibs	A collection of bioinformatics-related helper functions	https://github.com/kblin/bioinf-helperlibs/wiki
 	hera	hera is a bioinformatics tool that helps analyze RNA-seq data, providing base-to-base alignment BAM files, transcript abundance estimation, and fusion gene detection.	https://github.com/bioturing/hera
x	hgtools	Classes and setuptools plugin for Mercurial and Git repositories	https://github.com/jaraco/hgtools
 	hicexplorer	Set of programs to process, analyze and visualize Hi-C data	https://github.com/maxplanck-ie/HiCExplorer
 	hichipper	Processing HiChIP data into loops.	https://github.com/aryeelab/hichipper
 	hicup	A tool for mapping and performing quality control on Hi-C data	http://www.bioinformatics.babraham.ac.uk/projects/hicup/
 	hifive	Python library for normalizing and analyzing HiC and 5C data	https://github.com/bxlab/hifive
 	hisat2	graph-based alignment of next generation sequencing reads to a population of genomes	https://ccb.jhu.edu/software/hisat2/index.shtml
 	hivtrace	HIV TRACE is an application that identifies potential transmission clusters within a supplied FASTA file with an option to find potential links against the Los Alamos HIV Sequence Database.	https://github.com/veg/hivtrace
 	hlama	Simple matching of HTS samples based on HLA typing	https://github.com/bihealth/hlama
 	hlaprofiler	HLAProfiler uses k-mer profiles to predict HLA types from paired-end RNA-seq data.	https://github.com/ExpressionAnalysis/HLAProfiler
 	hmmer	Biosequence analysis using profile hidden Markov models	http://hmmer.org/
 	hmmer2	Biosequence analysis using profile hidden Markov models	http://hmmer.org/
 	hmmlearn	Hidden Markov Models in Python, with scikit-learn like API	https://github.com/hmmlearn/hmmlearn
 	homer	Software for motif discovery and next generation sequencing analysis	
 	hs-blastn	hs-blastn, a fast and accurate nucleotide-nucleotide sequences aligner.	https://github.com/chenying2016/queries
 	htsbox	HTSbox is a fork of early HTSlib. It is a collection of small experimental tools manipulating HTS-related files.	https://github.com/lh3/htsbox
 	htseq	HTSeq is a Python library to facilitate processing and analysis of data from high-throughput sequencing (HTS) experiments.	https://github.com/simon-anders/htseq
 	htslib	C library for high-throughput sequencing data formats.	https://github.com/samtools/htslib
x	httpretty	HTTP client mock for Python	http://github.com/gabrielfalcao/httpretty
 	hubward	Manage the visualization of large amounts of other people's [often messy] genomics data	https://github.com/daler/hubward
 	hubward-all	Meta-package for hubward including bedtools and UCSC tools	
 	humann2	HUMAnN is a pipeline for efficiently and accurately profiling the presence/absence and abundance of microbial pathways in a community from metagenomic or metatranscriptomic sequencing data	http://huttenhower.sph.harvard.edu/humann2
x	hurry.filesize	A simple Python library for human readable file sizes (or anything sized in bytes).	
 	ibdne	The IBDNe program estimates the historical effective population size of a homogenous population (from the output of IDBseq).	http://faculty.washington.edu/browning/ibdne.html
 	ibdseq	IBDseq is a software program for detecting segments of identity-by-descent (IBD) and homozygosity-by-descent (HBD) in unphased genetic sequence data.	http://faculty.washington.edu/browning/ibdseq.html
x	icqsol	A collection of utilities for constructing complex geometries from primitive shapes	https://github.com/pletzer/icqsol
 	idba	IDBA is a practical iterative De Bruijn Graph De Novo Assembler for sequence assembly in bioinformatics.	http://i.cs.hku.hk/~alse/hkubrg/projects/idba_ud/
 	idr	The IDR (Irreproducible Discovery Rate) framework is a unied approach to measure the reproducibility of ndings identied from replicate experiments and provide highly stable thresholds based on reproducibility.	https://github.com/nboley/idr
 	ig-checkfcs	quick FCS datatype check	https://github.com/ImmPortDB/ig-checkfcs
 	ig-checkflowtypes	quick flow-related datatype for galaxy checks	https://github.com/ImmPortDB/ig-checkflowtypes
 	ig-flowtools	set of tools for flow cytometry analysis	https://github.com/ImmPortDB/ig-flowtools
 	igblast	A tool for analyzing immunoglobulin (IG) and T cell receptor (TR) sequences.	http://www.ncbi.nlm.nih.gov/projects/igblast/
 	igdiscover	Analyze antibody repertoires and discover new V genes	https://igdiscover.se/
 	igv	Integrative Genomics Viewer. Fast, efficient, scalable visualization tool for genomics data and annotations	http://www.broadinstitute.org/software/igv/home
 	igvtools	command line tools for IGV	http://www.broadinstitute.org/igv/
