not_bio_related	name	summary	url
 	pybigwig	A python extension written in C for quick access to bigWig files.	https://github.com/dpryan79/pyBigWig
x	pycli	Simple, object-oriented approach to Python CLI apps	http://packages.python.org/pyCLI/
x	pycluster	Clustering module for Python	http://bonsai.hgc.jp/~mdehoon/software/cluster/software.htm#pycluster
 	pycoqc	Python 3 package for Jupyter Notebook, computing metrics and generating plots from Oxford Nanopore Albacore report	https://github.com/EnrightLab/pycoQC
 	pycsg	Python port of csg.js from Evan Wallace	https://github.com/pletzer/pycsg
 	pydna	Representing double stranded DNA and simulating cloning, homologous recombination, Gibson assembly, Gel electrophoresis etc.	https://github.com/BjornFJohansson/pydna
x	pyexcelerator	generating Excel 97+ files; importing Excel 95+ files; Excel files dumper; OLE2 files dumper; xls2txt, xls2csv, xls2html	http://sourceforge.net/projects/pyexcelerator/
 	pyfaidx	pyfaidx: efficient pythonic random access to fasta subsequences	http://mattshirley.com
 	pyfasta	fast, memory-efficient, pythonic (and command-line) access to fasta sequence files	http://github.com/brentp/pyfasta/
 	pyfastaq	Script to manipulate FASTA and FASTQ files, plus API for developers	https://github.com/sanger-pathogens/Fastaq
x	pygraphviz	Python interface to Graphviz	http://pygraphviz.github.io
x	pygresql	Python PostgreSQL Interfaces	http://www.pygresql.org
x	pyhashxx	Python wrapper for xxHash algorithm	http://github.com/ewencp/pyhashxx
 	pylibseq	A Python interface to libsequence	http://pypi.python.org/pypi/pylibseq
 	pyliftover	Pure-python implementation of UCSC ``liftOver`` genome coordinate conversion.	https://github.com/konstantint/pyliftover
 	pyloh	Deconvolving tumor purity and ploidy by integrating copy number alterations and loss of heterozygosity	https://github.com/uci-cbcl/PyLOH
x	pymix	Python mixture package	http://www.pymix.org/pymix
 	pymot	This is a python implementation which determines the MOTP and MOTA metrics from a set of ground truth tracks and a set of hypothesis tracks given by the tracker to be evaluated.	https://github.com/Videmo/pymot
 	pymummer	Wrapper for MUMmer	https://github.com/sanger-pathogens/pymummer
x	pymvpa	PyMVPA -- Multivariate Pattern Analysis in Python	http://www.pymvpa.org/
 	pymzml	high-throughput mzML parsing	http://pymzml.github.com
x	pynacl	Python binding to the Networking and Cryptography (NaCl) library	https://github.com/pyca/pynacl/
 	pynast	The Python Nearest Alignment Space Termination tool	http://qiime.org/pynast
x	pyomo	Pyomo: Python Optimization Modeling Objects	http://pyomo.org
x	pyopt		http://www.pyopt.org/index.html
 	pypeflow	Light weight and reusable make / flow data process library written in Python	https://github.com/PacificBiosciences/pypeFLOW
 	pypore	Pythonic/Cythonic Nanopore Translocation Analysis	http://parkin.github.io/pypore/
 	pyprophet	Python reimplementation of mProphet peak scoring	http://github.com/uweschmitt/pyprophet
x	pyqi	pyqi: expose your interface	http://bipy.github.io/pyqi
 	pyquant-ms	A framework for the analysis of quantitative mass spectrometry data	http://www.github.com/pandeylab/pyquant
x	pyquery	A jquery-like library for python	https://github.com/gawel/pyquery
 	pyrad	Assembly and analysis of RADseq data sets	https://github.com/wichert/pyrad
 	pysam	Pysam is a python module for reading and manipulating Samfiles. It is a lightweight wrapper of the samtools C-API. Pysam also includes an interface for tabix.	https://github.com/pysam-developers/pysam
 	pysamstats	A Python utility for calculating statistics against genome position based on sequence alignments from a SAM, BAM or CRAM file.	https://github.com/alimanfoo/pysamstats
 	pyscaf	Genome assembly scaffolding using information from paired-end/mate-pair libraries, long reads, and synteny to closely related species.	https://github.com/lpryszcz/pyScaf
x	pysftp	A friendly face on SFTP	https://bitbucket.org/dundeemt/pysftp
 	pysnptools	Python library for reading and manipulating genetic data	http://research.microsoft.com/en-us/um/redmond/projects/mscompbio/
x	pysvg	Python SVG Library	http://codeboje.de/pysvg/
 	pytabix	Fast random access to sorted files compressed with bgzip and indexed by tabix.	https://github.com/slowkow/pytabix
 	pyteomics	A framework for proteomics data analysis.	https://bitbucket.org/levitsky/pyteomics
x	pytest-marks	set marks on py.test test methods	https://github.com/adamgoucher/pytest-marks
x	pytest-timeout	py.test plugin to abort hanging tests	http://bitbucket.org/pytest-dev/pytest-timeout/
 	pythomics	A multi-omic python package	https://github.com/pandeylab/pythomics
 	python-bioext	A few handy bioinformatics tools not already in BioPython	https://github.com/veg/BioExt.git
 	python-chado	Chado library	https://github.com/galaxy-genome-annotation/python-chado
x	python-cluster	"python-cluster is a ""simple"" package that allows to create several groups (clusters) of objects from a list"	https://github.com/exhuma/python-cluster
 	python-consensuscore	C++ library of multiple-sequence consensus routines with SWIG bindings	https://github.com/PacificBiosciences/ConsensusCore
x	python-fakemp	Fake multiprocessing pool objects	https://github.com/nlhepler/fakemp
 	python-hivclustering	A Python 3 library that makes inferences on HIV-1 transmission networks.	https://github.com/veg/hivclustering
 	python-hppy	An intuitive HyPhy interface for Python	https://github.com/veg/hppy
 	python-hyphy-python	HyPhy package interface library	https://github.com/veg/hyphy-python
x	python-levenshtein	Python extension for computing string edit distances and similarities.	https://pypi.python.org/pypi/python-Levenshtein/
 	python-libsbml	LibSBML Python API. LibSBML is a library for reading, writing and manipulating the Systems Biology Markup Language (SBML).	http://sbml.org
 	python-omero	OME (Open Microscopy Environment) develops open-source software and data format standards for the storage and manipulation of biological light microscopy data.	http://www.openmicroscopy.org/
 	python-tripal	Tripal API library	https://github.com/galaxy-genome-annotation/python-tripal
x	python-wget	pure python download utility	http://bitbucket.org/techtonik/python-wget/
x	pythonpy	the swiss army knife of the command line	https://github.com/Russell91/pythonpy
x	pytriangle	A python interface to the 2D triangulation program TRIANGLE	https://github.com/pletzer/pytriangle
x	pyutilib	PyUtilib: A collection of Python utilities	https://software.sandia.gov/trac/pyutilib
 	pyvcf	A Variant Call Format reader for Python	https://github.com/jamescasbon/PyVCF
 	pywdl	A Python implementation of a WDL parser and language bindings.	https://github.com/broadinstitute/pywdl
x	pyx	Python package for the generation of PostScript, PDF, and SVG files	http://pyx.sourceforge.net/
x	qcli	qcli	
 	qcumber	Quality control, quality trimming, adapter removal and sequence content check of NGS data.	https://gitlab.com/RKIBioinformaticsPipelines/QCumber
 	qfilt	Filter sequencing data using some simple heuristics	https://github.com/veg/qfilt
 	qiime	Quantitative Insights Into Microbial Ecology	http://www.qiime.org
 	qiime-default-reference	Default reference data files for use with QIIME.	http://www.qiime.org
 	qiimetomaaslin	Data munging script to change text Qiime OTU tables to pcl-formatted, maaslin-compatible text files	https://huttenhower.sph.harvard.edu/maaslin
 	qorts	The QoRTs software package is a fast, efficient, and portable multifunction toolkit designed to assist in the analysis, quality control, and data management of RNA-Seq datasets.	http://hartleys.github.io/QoRTs/
 	qsignature	qsignature is a simple and highly effective method for detecting potential sample mix-ups using distance measurements between SNP	http://sourceforge.net/p/adamajava/wiki/Home/
 	qtip	A tandem simulation approach for accurately predicting read alignmentmapping qualities.	https://github.com/BenLangmead/qtip
 	quake	Quake is a package to correct substitution sequencing errors in experiments with deep coverage (e.g. >15X), specifically intended for Illumina sequencing reads	http://www.cbcb.umd.edu/software/quake/
 	qualimap	Quality control of alignment sequencing data and its derivatives like feature counts	http://qualimap.bioinfo.cipf.es/
 	quasitools	Quasitools is a collection of tools for analysing Viral Quasispecies	https://github.com/phac-nml/quasitools/
 	quast	Quality Assessment Tool for Genome Assemblies	https://sourceforge.net/projects/quast/
 	query_phenomizer	Tool for query and parsing the phenomizer tool	https://www.github.com/moonso/query_phenomizer
 	quorum	QuorUM (Quality Optimized Reads from the University of Maryland) is an error corrector for Illumina reads. It is distributed and used with MaSuRCA, or it can be used independently.	http://www.genome.umd.edu/quorum.html
 	r-alakazam	Provides immunoglobulin (Ig) sequence lineage reconstruction, diversity profiling, and amino acid property analysis.	http://alakazam.readthedocs.org
 	r-ampvis	A package to visualise amplicon data	https://github.com/MadsAlbertsen/ampvis
 	r-aroma.affymetrix	A cross-platform R framework that facilitates processing of any number of Affymetrix microarray samples regardless of computer system.  The only parameter that limits the number of chips that can be processed is the amount of available disk space.  The Aroma Framework has successfully been used in studies to process tens of thousands of arrays.  This package has actively been used since 2006.	http://www.aroma-project.org/, https://github.com/HenrikBengtsson/aroma.affymetrix
 	r-aroma.core	Core methods and classes used by higher-level aroma.* packages part of the Aroma Project, e.g. aroma.affymetrix and aroma.cn.	https://github.com/HenrikBengtsson/aroma.core, http://www.aroma-project.org/
 	r-bio3d	Utilities to process, organize and explore protein structure, sequence and dynamics data.  Features include the ability to read and write structure, sequence and dynamic trajectory data, perform sequence and structure database searches, data summaries, atom selection, alignment, superposition, rigid core identification, clustering, torsion analysis, distance matrix analysis, structure and sequence conservation analysis, normal mode analysis, principal component analysis of heterogeneous structure data, and correlation network analysis from normal mode and molecular dynamics data.  In addition, various utility functions are provided to enable the statistical and graphical power of the R environment to work with biological sequence and structural data.  Please refer to the URLs below for more information.	http://thegrantlab.org/bio3d/, http://bitbucket.org/Grantlab/bio3d
 	r-biom	This is an R package for interfacing with the BIOM format.	https://github.com/joey711/biom/, http://biom-format.org/
 	r-chbutils	Useful utility functions used at the Harvard Chan School Bioinformatics core	https://github.com/hbc/CHBUtils
 	r-cimpl	An analysis package for multi sample insertional mutagenesis data (including viral- and transposon-based systems) using Gaussian kernel convolution to identify common insertion sites.	http://ccb.nki.nl/software/
 	r-cnogpro	Methods for assigning copy number states and breakpoints in resequencing experiments of prokaryotic organisms.	https://CRAN.R-project.org/package=CNOGpro
 	r-coloc	Performs the colocalisation tests described in Plagnol et al (2009), Wallace et al (2013) and Giambartolomei et al (2013).	https://github.com/chr1swallace/coloc
x	r-data.table	Fast aggregation of large data (e.g. 100GB in RAM), fast ordered joins, fast add/modify/delete of columns by group using no copies at all, list columns, a fast friendly file reader and parallel file writer. Offers a natural and flexible syntax, for faster development.	http://r-datatable.com
 	r-dbchip	ChIP-seq differential binding	http://pages.cs.wisc.edu/~kliang/DBChIP
 	r-deoptimr	An implementation of a bespoke jDE variant of the Differential Evolution stochastic algorithm for global optimization of nonlinear programming problems.	
x	r-diptest	Compute Hartigan's dip test statistic for unimodality / multimodality and provide a test with simulation based p-values, where the original public code has been corrected.	https://CRAN.R-project.org/package=diptest
 	r-dpeak	This package provides functions for fitting dPeak, a statistical framework to deconvolve ChIP-seq peaks.	http://dongjunchung.github.io/dpeak/
 	r-drc	Analysis of dose-response data is made available through a suite of flexible and versatile model fitting and after-fitting functions.	http://www.r-project.org, http://www.bioassay.dk
 	r-dynamictreecut	Contains methods for detection of clusters in hierarchical clustering dendrograms.	http://www.genetics.ucla.edu/labs/horvath/CoexpressionNetwork/BranchCutting/
 	r-empiricalfdr.deseq2	Auxiliary functions for the DESeq2 package to simulate read counts according to the null hypothesis (i.e., with empirical sample size factors, per-gene total counts and dispersions, but without effects of predictor variables) and to compute the empirical false discovery rate.	
 	r-exomedepth	Calls copy number variants (CNVs) from targeted sequence data, typically exome sequencing experiments designed to identify the genetic basis of Mendelian disorders.	https://cran.r-project.org/web/packages/ExomeDepth/index.html
x	r-factominer	Exploratory data analysis methods to summarize, visualize and describe datasets. The main principal component methods are available, those with the largest potential in terms of applications: principal component analysis (PCA) when variables are quantitative, correspondence analysis (CA) and multiple correspondence analysis (MCA) when variables are categorical, Multiple Factor Analysis when variables are structured in groups, etc. and hierarchical cluster analysis.	http://factominer.free.fr
x	r-fnn	Cover-tree and kd-tree fast k-nearest neighbor search algorithms and related applications including KNN classification, regression and information measures are implemented.	https://CRAN.R-project.org/package=FNN
x	r-gam	"Functions for fitting and working with generalized additive models, as described in chapter 7 of ""Statistical Models in S"" (Chambers and Hastie (eds), 1991), and ""Generalized Additive Models"" (Hastie and Tibshirani, 1990)."	https://cran.r-project.org/web/packages/gam/index.html
x	r-gbm	An implementation of extensions to Freund and Schapire's AdaBoost algorithm and Friedman's gradient boosting machine. Includes regression methods for least squares, absolute loss, t-distribution loss, quantile regression, logistic, multinomial logistic, Poisson, Cox proportional hazards partial likelihood, AdaBoost exponential loss, Huberized hinge loss, and Learning to Rank measures (LambdaMart).	http://code.google.com/p/gradientboostedmodels/
 	r-genabel.data	GenABEL.data package consists of a data set used by GenABEL functions	http://www.genabel.org, http://forum.genabel.org, http://genabel.r-forge.r-project.org/
 	r-genenet	Analyzes gene expression (time series) data with focus on the inference of gene networks. In particular, GeneNet implements the methods of Schaefer and  Strimmer (2005a,b,c) and Opgen-Rhein and Strimmer (2006, 2007) for learning large-scale gene association networks (including assignment of putative directions).  	http://strimmerlab.org/software/genenet/
 	r-george	geoRge, a computational tool for stable isotope labelling detection in LC/MS-based untargeted metabolomics	https://github.com/jcapelladesto/geoRge/README.md
x	r-ggthemes	Some extra themes, geoms, and scales for ggplot2. Provides ggplot2 themes and scales that replicate the look of plots by Edward Tufte, Stephen Few, Fivethirtyeight, The Economist, Stata, Excel, and The Wall Street Journal, among others. Provides geoms for Tufte s box plot and range frame.	https://cran.rstudio.com/web/packages/ggthemes/index.html
 	r-giant	Toolbox for various enrichment analysis methods and quantification of uncertainty of gene sets.	https://cran.r-project.org/web/packages/GiANT/index.html
 	r-gprofiler	Functional enrichment analysis, gene identifier conversion and mapping homologous genes across related organisms via the 'g:Profiler' toolkit (http://biit.cs.ut.ee/gprofiler/).	https://CRAN.R-project.org/package=gProfileR
 	r-gpseq	Some functions for modeling sequence read counts as a generalized poisson model and to use this model for detecting differentially expressed genes in different conditions and differentially spliced exons.	https://CRAN.R-project.org/package=GPseq
x	r-grimport	Functions for converting, importing, and drawing PostScript  pictures in R plots.	
 	r-gsalib	This package contains utility functions used by the Genome Analysis Toolkit (GATK) to load tables and plot data. The GATK is a toolkit for variant discovery in high-throughput sequencing data.	
x	r-gsmoothr	Tools rewritten in C for various smoothing tasks	
 	r-histonehmm	histoneHMM is a software to analyse ChIP-seq data of histone modifications with broad genomic footprints like H3K27me3. It allows for calling modified regions in single samples as well as for calling differentially modified regions in a comparison of two samples	http://histonehmm.molgen.mpg.de/
x	r-idpmisc	The IDPmisc package contains different high-level graphics functions for displaying large datasets, displaying circular data in a very flexible way, finding local maxima, brewing color ramps, drawing nice arrows, zooming 2D-plots, creating figures with differently colored margin and plot region.  In addition, the package contains auxiliary functions for data manipulation like omitting observations with irregular values or selecting data by logical vectors, which include NAs. Other functions are especially useful in spectroscopy and analyses of environmental data: robust baseline fitting, finding peaks in spectra.	
 	r-idr	"This is a package for estimating the copula mixture model and plotting correspondence curves in ""Measuring reproducibility of high-throughput experiments"" (2011), Annals of Applied Statistics, Vol. 5, No. 3, 1752-1779, by Li, Brown, Huang, and Bickel "	https://sites.google.com/site/anshulkundaje/projects/idr
x	r-inlinedocs	Generates Rd files from R source code with comments. The main features of the default syntax are that (1) docs are defined in comments near the relevant code, (2) function argument names are not repeated in comments, and (3) examples are defined in R code, not comments. It is also easy to define a new syntax.	http://inlinedocs.r-forge.r-project.org
x	r-km.ci	Computes various confidence intervals for the Kaplan-Meier estimator, namely Petos CI, Rothman CI, CI's based on Greenwoods variance, Thomas and Grunkemeier CI and the simultaneous confidence bands by Nair and Hall and Wellner.	https://cran.rstudio.com/web/packages/km.ci/index.html
x	r-kmsurv	"Data sets and functions for Klein and Moeschberger (1997), ""Survival Analysis, Techniques for Censored and Truncated Data"", Springer."	https://cran.rstudio.com/web/packages/KMsurv/index.html
x	r-kriging	Simple and highly optimized ordinary kriging algorithm to plot geographical data	https://CRAN.R-project.org/package=kriging
x	r-lsd	Create lots of colorful plots in a plethora of variations (try the LSD demotour() )	
 	r-maldiquant	A complete analysis pipeline for matrix-assisted laser desorption/ionization-time-of-flight (MALDI-TOF) and other two-dimensional mass spectrometry data. In addition to commonly used plotting and processing methods it includes distinctive features, namely baseline subtraction methods such as morphological filters (TopHat) or the statistics-sensitive non-linear iterative peak-clipping algorithm (SNIP), peak alignment using warping functions, handling of replicated measurements as well as allowing spectra with different resolutions.	http://strimmerlab.org/software/maldiquant/ https://github.com/sgibb/MALDIquant/
 	r-maldiquantforeign	Functions for reading (tab, csv, Bruker fid, Ciphergen XML, mzXML, mzML, imzML, Analyze 7.5, CDF, mMass MSD) and writing (tab, csv, mMass MSD, mzML, imzML) different file formats of mass spectrometry data into/from MALDIquant objects.	http://strimmerlab.org/software/maldiquant/ https://github.com/sgibb/MALDIquantForeign/
 	r-matrixeqtl	Matrix eQTL is designed for fast eQTL analysis on large datasets. Matrix eQTL can test for association between genotype and gene expression using linear regression  with either additive or ANOVA genotype effects. The models can include covariates to account for factors  as population stratification, gender, and clinical variables.  It also supports models with heteroscedastic and/or correlated errors, false discovery rate estimation and separate treatment of local (cis) and distant (trans) eQTLs.	http://www.bios.unc.edu/research/genomic_software/Matrix_eQTL/
 	r-micropan	A collection of functions for computations and visualizations of microbial pan-genomes.	https://CRAN.R-project.org/package=micropan
 	r-microseq	Basic functions for microbial sequence data analysis.	https://CRAN.R-project.org/package=microseq
 	r-mixomics	Multivariate methods are well suited to large omics data sets where the number ofvariables (e.g. genes, proteins, metabolites) is much larger than the number ofsamples (patients, cells, mice). They have the appealing properties of reducingthe dimension of the data by using instrumental variables (components), which aredefined as combinations of all variables. Those components are then used to produceuseful graphical outputs that enable better understanding of the relationships andcorrelation structures between the different data sets that are integrated. mixOmicsoffers a wide range of multivariate methods for the exploration and integrationof biological datasets with a particular focus on variable selection. The packageproposes several sparse multivariate models we have developed to identify the keyvariables that are highly correlated, and/or explain the biological outcome of interest.The data that can be analysed with mixOmics may come from high throughput sequencingtechnologies, such as omics data (transcriptomics, metabolomics, proteomics, metagenomicsetc) but also beyond the realm of omics (e.g. spectral imaging). The methods implementedin mixOmics can also handle missing values without having to delete entire rowswith missing data. A non exhaustive list of methods include generalised CanonicalCorrelation Analysis, sparse Partial Least Squares and sparse Discriminant Analysis.Recently we implemented integrative methods to combine multiple data sets: horizontalintegration with regularised Generalised Canonical Correlation Analysis and verticalintegration with multi-group Partial Least Squares.	http://www.mixOmics.org
 	r-mlgt	Processing and analysis of high throughput (Roche 454) sequences generated from multiple loci and multiple biological samples. Sequences are assigned to their locus and sample of origin, aligned and trimmed. Where possible, genotypes are called and variants mapped to known alleles.	http://personalpages.manchester.ac.uk/staff/David.Gerrard/
 	r-mmgenome	Tools for extracting individual genomes from metagneomes	https://github.com/MadsAlbertsen/mmgenome
 	r-mutationalpatterns	R package for extracting and visualizing mutational patterns in base substitution catalogues	https://github.com/CuppenResearch/MutationalPatterns
 	r-mutoss	The Mutoss package and accompanying mutossGUI package are designed to ease the application and comparison of multiple hypothesis testing procedures.	http://mutoss.r-forge.r-project.org/
 	r-nanostringnorm	A set of tools for normalizing, diagnostics and visualization of NanoString nCounter data.	
 	r-nastiseq	Pairs of RNA molecules transcribed from partially or entirely complementary loci are called cis-natural antisense transcripts (cis-NATs), and they play key roles in the regulation of gene expression in many organisms. A promising experimental tool for profiling sense and antisense transcription is strand-specific RNA sequencing (ssRNA-seq). To identify cis-NATs using ssRNA-seq, we developed a new computational method based on model comparison that incorporates the inherent variable efficiency of generating perfectly strand-specific libraries. Applying the method to new ssRNA-seq data from whole root and cell-type specific Arabidopsis libraries confirmed most of the known cis-NAT pairs and identified hundreds of additional cis-NAT pairs.	https://ohlerlab.mdc-berlin.de/software/NASTIseq_104/
 	r-patpro	Quickly and easily visualize longitudinal microbiome profiles using standard output from the QIIME microbiome analysis toolkit (see <http://qiime.org> for more information).	https://github.com/Microbiology/patPRO
 	r-peer	PEER is a collection of Bayesian approaches to infer hidden determinants and their effects from gene expression profiles using factor analysis methods. Applications of PEER have (i) detected batch effects and experimental confounders (ii) increased the number of expression QTL findings by threefold and (iii) allowed inference of intermediate cellular traits, such as transcription factor or pathway activations. This project offers an efficient and versatile C++ implementation of the underlying algorithms with user-friendly interfaces to R and python. 	
 	r-plasmidprofiler	Plasmid profiler	
 	r-pore	An R package to enable organisation and visualisation of nanopore sequencing data	http://sourceforge.net/projects/rpore/
 	r-probmetab	Provides probability ranking to candidate compounds assigned to masses, with the prior assumption of connected sample and additional previous and spectral information modeled by the user.	https://github.com/rsilvabioinfo/ProbMetab
 	r-pscbs	Segmentation of allele-specific DNA copy number data and detectionof regions with abnormal copy number within each parental chromosome.  Both tumor-normalpaired and tumor-only analyses are supported.	https://github.com/HenrikBengtsson/PSCBS
