not_bio_related	name	summary	url
 	bioconductor-motifdb	More than 2000 annotated position frequency matrices from nine public sources, for multiple organisms.	http://bioconductor.org/packages/release/bioc/html/MotifDb.html
 	bioconductor-motifrg	Tools for discriminative motif discovery using regression methods	https://www.bioconductor.org/packages/release/bioc/html/motifRG.html
 	bioconductor-motifstack	The motifStack package is designed for graphic representation of multiple motifs with different similarity scores. It works with both DNA/RNA sequence motif and amino acid sequence motif. In addition, it provides the flexibility for users to customize the graphic parameters such as the font type and symbol colors.	http://bioconductor.org/packages/release/bioc/html/motifStack.html
 	bioconductor-motiv	This package makes use of STAMP for comparing a set of motifs to a given database (e.g. JASPAR). It can also be used to visualize motifs, motif distributions, modules and filter motifs.	http://bioconductor.org/packages/3.5/bioc/html/MotIV.html
 	bioconductor-mpfe	Estimate distribution of methylation patterns from a table of counts from a bisulphite sequencing experiment given a non-conversion rate and read error rate.	http://bioconductor.org/packages/3.5/bioc/html/MPFE.html
 	bioconductor-mulcom	Identification of differentially expressed genes and false discovery rate (FDR) calculation by Multiple Comparison test	http://bioconductor.org/packages/3.5/bioc/html/Mulcom.html
 	bioconductor-multidataset	Implementation of the BRGE's (Bioinformatic Research Group in Epidemiology from Center for Research in Environmental Epidemiology) MultiDataSet and MethylationSet. MultiDataSet is designed for integrating multi omics data sets and MethylationSet to contain normalized methylation data. These package contains base classes for MEAL and rexposome packages.	http://bioconductor.org/packages/3.5/bioc/html/MultiDataSet.html
 	bioconductor-multimed	Implements permutation method with joint correction for testing multiple mediators	http://bioconductor.org/packages/3.5/bioc/html/MultiMed.html
 	bioconductor-multiscan	Estimates gene expressions from several laser scans of the same microarray	http://bioconductor.org/packages/3.5/bioc/html/multiscan.html
 	bioconductor-multtest	Non-parametric bootstrap and permutation resampling-based multiple testing procedures (including empirical Bayes methods) for controlling the family-wise error rate (FWER), generalized family-wise error rate (gFWER), tail probability of the proportion of false positives (TPPFP), and false discovery rate (FDR).  Several choices of bootstrap-based null distribution are implemented (centered, centered and scaled, quantile-transformed). Single-step and step-wise methods are available. Tests based on a variety of t- and F-statistics (including t-statistics based on regression parameters from linear and survival models as well as those based on correlation parameters) are included.  When probing hypotheses with t-statistics, users may also select a potentially faster null distribution which is multivariate normal with mean zero and variance covariance matrix derived from the vector influence function.  Results are reported in terms of adjusted p-values, confidence regions and test statistic cutoffs. The procedures are directly applicable to identifying differentially expressed genes in DNA microarray experiments.	http://bioconductor.org/packages/3.5/bioc/html/multtest.html
 	bioconductor-mvcclass	Creates classes used in model-view-controller (MVC) design	http://bioconductor.org/packages/3.5/bioc/html/MVCClass.html
 	bioconductor-mvgst	mvGST provides platform-independent tools to identify GO terms (gene sets) that are differentially active (up or down) in multiple contrasts of interest.  Given a matrix of one-sided p-values (rows for genes, columns for contrasts), mvGST uses meta-analytic methods to combine p-values for all genes annotated to each gene set, and then classify each gene set as being significantly more active (1), less active (-1), or not significantly differentially active (0) in each contrast of interest.  With multiple contrasts of interest, each gene set is assigned to a profile (across contrasts) of differential activity.  Tools are also provided for visualizing (in a GO graph) the gene sets classified to a given profile.	http://bioconductor.org/packages/3.5/bioc/html/mvGST.html
 	bioconductor-myvariant	MyVariant.info is a comprehensive aggregation of variant annotation resources. myvariant is a wrapper for querying MyVariant.info services	http://bioconductor.org/packages/3.5/bioc/html/myvariant.html
 	bioconductor-mzid	A parser for mzIdentML files implemented using the XML package. The parser tries to be general and able to handle all types of mzIdentML files with the drawback of having less 'pretty' output than a vendor specific parser. Please contact the maintainer with any problems and supply an mzIdentML file so the problems can be fixed quickly.	http://bioconductor.org/packages/3.5/bioc/html/mzID.html
 	bioconductor-mzr	mzR provides a unified API to the common file formats and parsers available for mass spectrometry data. It comes with a wrapper for the ISB random access parser for mass spectrometry mzXML, mzData and mzML files. The package contains the original code written by the ISB, and a subset of the proteowizard library for mzML and mzIdentML. The netCDF reading code has previously been used in XCMS.	http://bioconductor.org/packages/release/bioc/html/mzR.html
 	bioconductor-ncdfflow	Provides HDF5 storage based methods and functions for manipulation of flow cytometry data.	http://bioconductor.org/packages/release/bioc/html/ncdfFlow.html
 	bioconductor-ncigraph	Provides various methods to load the pathways from the NCI Pathways Database in R graph objects and to re-format them.	http://bioconductor.org/packages/3.5/bioc/html/NCIgraph.html
 	bioconductor-nem	The package 'nem' allows to reconstruct features of pathways from the nested structure of perturbation effects. It takes as input (1.) a set of pathway components, which were perturbed, and (2.) phenotypic readout of these perturbations (e.g. gene expression, protein expression). The output is a directed graph representing the phenotypic hierarchy.	http://bioconductor.org/packages/3.5/bioc/html/nem.html
 	bioconductor-netbiov	A package that provides an effective visualization of large biological networks	http://bioconductor.org/packages/3.5/bioc/html/netbiov.html
 	bioconductor-netpathminer	NetPathMiner is a general framework for network path mining using genome-scale networks. It constructs networks from KGML, SBML and BioPAX files, providing three network representations, metabolic, reaction and gene representations. NetPathMiner finds active paths and applies machine learning methods to summarize found paths for easy interpretation. It also provides static and interactive visualizations of networks and paths to aid manual investigation.	http://bioconductor.org/packages/3.5/bioc/html/NetPathMiner.html
 	bioconductor-nnnorm	This package allows to detect and correct for spatial and intensity biases with two-channel microarray data. The normalization method implemented in this package is based on robust neural networks fitting.	http://bioconductor.org/packages/3.5/bioc/html/nnNorm.html
 	bioconductor-noiseq	Analysis of RNA-seq expression data or other similar kind of data. Exploratory plots to evualuate saturation, count distribution, expression per chromosome, type of detected features, features length, etc. Differential expression between two experimental conditions with no parametric assumptions.	http://bioconductor.org/packages/release/bioc/html/NOISeq.html
 	bioconductor-npgsea	Current gene set enrichment methods rely upon permutations for inference.  These approaches are computationally expensive and have minimum achievable p-values based on the number of permutations, not on the actual observed statistics.  We have derived three parametric approximations to the permutation distributions of two gene set enrichment test statistics.  We are able to reduce the computational burden and granularity issues of permutation testing with our method, which is implemented in this package. npGSEA calculates gene set enrichment statistics and p-values without the computational cost of permutations.  It is applicable in settings where one or many gene sets are of interest.  There are also built-in plotting functions to help users visualize results.	http://bioconductor.org/packages/3.5/bioc/html/npGSEA.html
 	bioconductor-ntw	This package predicts the gene-gene interaction network and identifies the direct transcriptional targets of the perturbation using an ODE (Ordinary Differential Equation) based method.	http://bioconductor.org/packages/3.5/bioc/html/NTW.html
 	bioconductor-nucleosim	This package can generate a synthetic map with reads covering the nucleosome regions as well as a synthetic map with forward and reverse reads emulating next-generation sequencing. The user has choice between three different distributions for the read positioning: Normal, Student and Uniform.	http://bioconductor.org/packages/3.5/bioc/html/nucleoSim.html
 	bioconductor-nucler	Nucleosome positioning for Tiling Arrays and NGS experiments.	http://bioconductor.org/packages/3.5/bioc/html/nucleR.html
 	bioconductor-nudge	Package for normalizing microarray data in single and multiple replicate experiments and fitting a normal-uniform mixture to detect differentially expressed genes in the cases where the two samples are being compared directly or indirectly (via a common reference sample)	http://bioconductor.org/packages/3.5/bioc/html/nudge.html
 	bioconductor-occugene	Statistical tools for building random mutagenesis libraries for prokaryotes. The package has functions for handling the occupancy distribution for a multinomial and for estimating the number of essential genes in random transposon mutagenesis libraries.	http://bioconductor.org/packages/3.5/bioc/html/occugene.html
 	bioconductor-ogsa	OGSA provides a global estimate of pathway deregulation in cancer subtypes by integrating the estimates of significance for individual pathway members that have been identified by outlier analysis.	http://bioconductor.org/packages/3.5/bioc/html/OGSA.html
 	bioconductor-oligo	A package to analyze oligonucleotide arrays (expression/SNP/tiling/exon) at probe-level. It currently supports Affymetrix (CEL files) and NimbleGen arrays (XYS files).	https://bioconductor.org/packages/3.5/bioc/html/oligo.html
 	bioconductor-oligoclasses	This package contains class definitions, validity checks, and initialization methods for classes used by the oligo and crlmm packages.	https://bioconductor.org/packages/3.5/bioc/html/oligoClasses.html
 	bioconductor-olin	Functions for normalisation of two-color microarrays by optimised local regression and for detection of artefacts in microarray data	http://bioconductor.org/packages/3.5/bioc/html/OLIN.html
 	bioconductor-omicade4	Multiple co-inertia analysis of omics datasets	http://bioconductor.org/packages/3.5/bioc/html/omicade4.html
 	bioconductor-omiccircos	OmicCircos is an R application and package for generating high-quality circular plots for omics data.	http://bioconductor.org/packages/3.5/bioc/html/OmicCircos.html
 	bioconductor-oppar	The R implementation of mCOPA package published by Wang et al. (2012). Oppar provides methods for Cancer Outlier profile Analysis. Although initially developed to detect outlier genes in cancer studies, methods presented in oppar can be used for outlier profile analysis in general. In addition, tools are provided for gene set enrichment and pathway analysis.	http://bioconductor.org/packages/3.5/bioc/html/oppar.html
 	bioconductor-org.bt.eg.db	Genome wide annotation for Bovine, primarily based on mapping using Entrez Gene identifiers.	http://bioconductor.org/packages/release/data/annotation/html/org.Bt.eg.db.html
 	bioconductor-org.ce.eg.db	Genome wide annotation for Worm, primarily based on mapping using Entrez Gene identifiers.	http://bioconductor.org/packages/release/data/annotation/html/org.Ce.eg.db.html
 	bioconductor-org.cf.eg.db	Genome wide annotation for Canine, primarily based on mapping using Entrez Gene identifiers.	http://bioconductor.org/packages/release/data/annotation/html/org.Cf.eg.db.html
 	bioconductor-org.dm.eg.db	Genome wide annotation for Fly, primarily based on mapping using Entrez Gene identifiers.	http://bioconductor.org/packages/3.5/data/annotation/html/org.Dm.eg.db.html
 	bioconductor-org.dr.eg.db	Genome wide annotation for Zebrafish, primarily based on mapping using Entrez Gene identifiers.	http://bioconductor.org/packages/release/data/annotation/html/org.Dr.eg.db.html
 	bioconductor-org.gg.eg.db	Genome wide annotation for Chicken, primarily based on mapping using Entrez Gene identifiers.	http://bioconductor.org/packages/release/data/annotation/html/org.Gg.eg.db.html
 	bioconductor-org.hs.eg.db	Genome wide annotation for Human, primarily based on mapping using Entrez Gene identifiers.	http://bioconductor.org/packages/3.5/data/annotation/html/org.Hs.eg.db.html
 	bioconductor-org.mm.eg.db	Genome wide annotation for Mouse, primarily based on mapping using Entrez Gene identifiers.	http://bioconductor.org/packages/release/data/annotation/html/org.Mm.eg.db.html
 	bioconductor-org.rn.eg.db	Genome wide annotation for Rat, primarily based on mapping using Entrez Gene identifiers.	http://bioconductor.org/packages/release/data/annotation/html/org.Rn.eg.db.html
 	bioconductor-org.ss.eg.db	Genome wide annotation for Pig, primarily based on mapping using Entrez Gene identifiers.	http://bioconductor.org/packages/release/data/annotation/html/org.Ss.eg.db.html
 	bioconductor-organismdbi	The package enables a simple unified interface to several annotation packages each of which has its own schema by taking advantage of the fact that each of these packages implements a select methods.	http://bioconductor.org/packages/release/bioc/html/OrganismDbi.html
 	bioconductor-osat	A sizable genomics study such as microarray often involves the use of multiple batches (groups) of experiment due to practical complication. To minimize batch effects, a careful experiment design should ensure the even distribution of biological groups and confounding factors across batches. OSAT (Optimal Sample Assignment Tool) is developed to facilitate the allocation of collected samples to different batches. With minimum steps, it produces setup that optimizes the even distribution of samples in groups of biological interest into different batches, reducing the confounding or correlation between batches and the biological variables of interest. It can also optimize the even distribution of confounding factors across batches. Our tool can handle challenging instances where incomplete and unbalanced sample collections are involved as well as ideal balanced RCBD. OSAT provides a number of predefined layout for some of the most commonly used genomics platform. Related paper can be find at http://www.biomedcentral.com/1471-2164/13/689 .	http://bioconductor.org/packages/3.5/bioc/html/OSAT.html
 	bioconductor-oscope	Oscope is a statistical pipeline developed to identifying and recovering the base cycle profiles of oscillating genes in an unsynchronized single cell RNA-seq experiment. The Oscope pipeline includes three modules: a sine model module to search for candidate oscillator pairs; a K-medoids clustering module to cluster candidate oscillators into groups; and an extended nearest insertion module to recover the base cycle order for each oscillator group.	http://bioconductor.org/packages/3.5/bioc/html/Oscope.html
 	bioconductor-otubase	Provides a platform for Operational Taxonomic Unit based analysis	http://bioconductor.org/packages/3.5/bioc/html/OTUbase.html
 	bioconductor-outlierd	This package detects outliers using quantile regression on the M-A scatterplots of high-throughput data.	http://bioconductor.org/packages/3.5/bioc/html/OutlierD.html
 	bioconductor-paircompviz	This package provides visualization of the results from the multiple (i.e. pairwise) comparison tests such as pairwise.t.test, pairwise.prop.test or pairwise.wilcox.test. The groups being compared are visualized as nodes in Hasse diagram. Such approach enables very clear and vivid depiction of which group is significantly greater than which others, especially if comparing a large number of groups.	http://bioconductor.org/packages/3.5/bioc/html/paircompviz.html
 	bioconductor-pannbuilder	Processing annotation data from public data repositories and building protein-centric annotation data packages.	http://bioconductor.org/packages/3.5/bioc/html/PAnnBuilder.html
 	bioconductor-panp	A function to make gene presence/absence calls based on distance from negative strand matching probesets (NSMP) which are derived from Affymetrix annotation. PANP is applied after gene expression values are created, and therefore can be used after any preprocessing method such as MAS5 or GCRMA, or PM-only methods like RMA. NSMP sets have been established for the HGU133A and HGU133-Plus-2.0 chipsets to date.	http://bioconductor.org/packages/3.5/bioc/html/panp.html
 	bioconductor-papi	The Pathway Activity Profiling - PAPi - is an R package for predicting the activity of metabolic pathways based solely on a metabolomics data set containing a list of metabolites identified and their respective abundances in different biological samples. PAPi generates hypothesis that improves the final biological interpretation. See Aggio, R.B.M; Ruggiero, K. and Villas-Boas, S.G. (2010) - Pathway Activity Profiling (PAPi): from metabolite profile to metabolic pathway activity. Bioinformatics.	http://bioconductor.org/packages/3.5/bioc/html/PAPi.html
 	bioconductor-parody	routines for univariate and multivariate outlier detection with a focus on parametric methods, but support for some methods based on resistant statistics	http://bioconductor.org/packages/3.5/bioc/html/parody.html
 	bioconductor-path2ppi	Package to predict protein-protein interaction (PPI) networks in target organisms for which only a view information about PPIs is available. Path2PPI predicts PPI networks based on sets of proteins which can belong to a certain pathway from well-established model organisms. It helps to combine and transfer information of a certain pathway or biological process from several reference organisms to one target organism. Path2PPI only depends on the sequence similarity of the involved proteins.	http://bioconductor.org/packages/3.5/bioc/html/Path2PPI.html
 	bioconductor-pathnet	PathNet uses topological information present in pathways and differential expression levels of genes (obtained from microarray experiment) to identify pathways that are 1) significantly enriched and 2) associated with each other in the context of differential expression. The algorithm is described in: PathNet: A tool for pathway analysis using topological information. Dutta B, Wallqvist A, and Reifman J. Source Code for Biology and Medicine 2012 Sep 24;7(1):10.	http://bioconductor.org/packages/3.5/bioc/html/PathNet.html
 	bioconductor-pathview	Pathview is a tool set for pathway based data integration and visualization. It maps and renders a wide variety of biological data on relevant pathway graphs. All users need is to supply their data and specify the target pathway. Pathview automatically downloads the pathway graph data, parses the data file, maps user data to the pathway, and render pathway graph with the mapped data. In addition, Pathview also seamlessly integrates with pathway and gene set (enrichment) analysis tools for large-scale and fully automated analysis.	http://bioconductor.org/packages/release/bioc/html/pathview.html
 	bioconductor-pcaexplorer	This package provides functionality for interactive visualization of RNA-seq datasets based on Principal Components Analysis. The methods provided allow for quick information extraction and effective data exploration. A Shiny application encapsulates the whole analysis.	http://bioconductor.org/packages/release/bioc/html/pcaExplorer.html
 	bioconductor-pcamethods	Provides Bayesian PCA, Probabilistic PCA, Nipals PCA, Inverse Non-Linear PCA and the conventional SVD PCA. A cluster based method for missing value estimation is included for comparison. BPCA, PPCA and NipalsPCA may be used to perform PCA on incomplete data as well as for accurate missing value estimation. A set of methods for printing and plotting the results is also provided. All PCA methods make use of the same data structure (pcaRes) to provide a common interface to the PCA results. Initiated at the Max-Planck Institute for Molecular Plant Physiology, Golm, Germany.	http://bioconductor.org/packages/release/bioc/html/pcaMethods.html
 	bioconductor-pcan	Phenotypes comparison based on a pathway consensus approach. Assess the relationship between candidate genes and a set of phenotypes based on additional genes related to the candidate (e.g. Pathways or network neighbors).	http://bioconductor.org/packages/3.5/bioc/html/PCAN.html
 	bioconductor-pchicdata	Subsets of Promoter Capture Hi-C data conveniently packaged for Chicago users. Data includes interactions detected for chromosomes 20 and 21 in GM12878 cells and for chromosomes 18 and 19 in mESC.	http://bioconductor.org/packages/release/data/experiment/html/PCHiCdata.html
 	bioconductor-peca	Calculates Probe-level Expression Change Averages (PECA) to identify differential expression in Affymetrix gene expression microarray studies or in proteomic studies using peptide-level mesurements respectively.	http://bioconductor.org/packages/3.5/bioc/html/PECA.html
 	bioconductor-pepstat	Statistical analysis of peptide microarrays	http://bioconductor.org/packages/3.5/bioc/html/pepStat.html
 	bioconductor-pepxmltab	Parsing pepXML files based one XML package. The package tries to handle pepXML files generated from different softwares. The output will be a peptide-spectrum-matching tabular file. The package also provide function to filter the PSMs based on FDR.	http://bioconductor.org/packages/3.5/bioc/html/pepXMLTab.html
 	bioconductor-phyloseq	phyloseq provides a set of classes and tools to facilitate the import, storage, analysis, and graphical display of microbiome census data.	http://bioconductor.org/packages/release/bioc/html/phyloseq.html
 	bioconductor-piano	Piano performs gene set analysis using various statistical methods, from different gene level statistics and a wide range of gene-set collections. Furthermore, the Piano package contains functions for combining the results of multiple runs of gene set analyses.	http://bioconductor.org/packages/release/bioc/html/piano.html
 	bioconductor-pickgene	Functions to Analyze Microarray (Gene Expression) Data.	http://bioconductor.org/packages/3.5/bioc/html/pickgene.html
 	bioconductor-pics	Probabilistic inference of ChIP-Seq using an empirical Bayes mixture model approach.	http://bioconductor.org/packages/3.5/bioc/html/PICS.html
 	bioconductor-pkgdeptools	This package provides tools for computing and analyzing dependency relationships among R packages.  It provides tools for building a graph-based representation of the dependencies among all packages in a list of CRAN-style package repositories.  There are also utilities for computing installation order of a given package.  If the RCurl package is available, an estimate of the download size required to install a given package and its dependencies can be obtained.	http://bioconductor.org/packages/3.5/bioc/html/pkgDepTools.html
 	bioconductor-plgem	The Power Law Global Error Model (PLGEM) has been shown to faithfully model the variance-versus-mean dependence that exists in a variety of genome-wide datasets, including microarray and proteomics data. The use of PLGEM has been shown to improve the detection of differentially expressed genes or proteins in these datasets.	http://bioconductor.org/packages/3.5/bioc/html/plgem.html
 	bioconductor-plier	The PLIER (Probe Logarithmic Error Intensity Estimate) method produces an improved signal by accounting for experimentally observed patterns in probe behavior and handling error at the appropriately at low and high signal values.	http://bioconductor.org/packages/3.5/bioc/html/plier.html
 	bioconductor-plw	Probe level Locally moderated Weighted median-t (PLW) and Locally Moderated Weighted-t (LMW).	http://bioconductor.org/packages/3.5/bioc/html/plw.html
 	bioconductor-podkat	This package provides an association test that is capable of dealing with very rare and even private variants. This is accomplished by a kernel-based approach that takes the positions of the variants into account. The test can be used for pre-processed matrix data, but also directly for variant data stored in VCF files. Association testing can be performed whole-genome, whole-exome, or restricted to pre-defined regions of interest. The test is complemented by tools for analyzing and visualizing the results.	http://bioconductor.org/packages/3.5/bioc/html/podkat.html
 	bioconductor-polyfit	Polyfit is an add-on to the packages DESeq which ensures the p-value distribution is uniform over the interval [0, 1] for data satisfying the null hypothesis of no differential expression, and uses an adpated Storey-Tibshiran method to calculate q-values.	http://bioconductor.org/packages/3.5/bioc/html/Polyfit.html
 	bioconductor-prada	Tools for analysing and navigating data from high-throughput phenotyping experiments based on cellular assays and fluorescent detection (flow cytometry (FACS), high-content screening microscopy).	http://bioconductor.org/packages/3.5/bioc/html/prada.html
 	bioconductor-preprocesscore	A library of core preprocessing routines	http://bioconductor.org/packages/release/bioc/html/preprocessCore.html
