username	name	affiliation	commits
bgruening	Björn Grüning	Bioinformatics Group, Department of Computer Science, University of Freiburg, Freiburg, Germany	2566
daler	Ryan Dale	Laboratory of Cellular and Developmental Biology, National Institute of Diabetes and Digestive and Kidney Diseases, National Institutes of Health, Bethesda, United States	1804
druvus	Andreas Sjödin	Division of CBRN Security and Defence, FOI - Swedish Defence Research Agency, Umeå. Sweden; Department of Chemistry, Computational Life Science Cluster (CLiC), Umeå University, Umeå, Sweden	1101
chapmanb	Brad A. Chapman	Harvard T.H. Chan School of Public Health, Boston, United States	661
jerowe	Jillian Rowe	NYU Abu Dhabi, Abu Dhabi, United Arab Emirates	626
tomkinsc	Christopher H. Tomkins-Tinch	Department of Organismic and Evolutionary Biology, Harvard University, Cambridge, United States; Broad Institute of MIT and Harvard, Cambridge, United States	559
rvalieris	Renan Valieris	Laboratory of Bioinformatics and Computational Biology, A. C. Camargo Cancer Center, São Paulo, Brazil	64
acaprez	Adam Caprez	Holland Computing Center, University of Nebraska, Lincoln, United States	444
bebatut	Bérénice Batut	Bioinformatics Group, Department of Computer Science, University of Freiburg, Freiburg, Germany	380
MathiasHaudgaard	Mathias Haudgaard	Bioinformatics Research Centre, Aarhus University, Aarhus, Denmark	238
cokelaer	Thomas Cokelaer	Bioinformatics and Biostatistics Hub - C3BI, USR 3756 IP CNRS, Institut Pasteur, Paris, France	216
kyleabeauchamp	Kyle A. Beauchamp	Counsyl, South San Francisco, United States	183
brentp	Brent S Pedersen	Department of Human Genetics, University of Utah, Eccles Institute of Human Genetics, Salt Lake City	167
yhoogstrate	Youri Hoogstrate	 Erasmus Medical Center, Department of Urology, Rotterdam, The Netherlands	163
dpryan79	Devon Ryan	Bioinformatics core facility, Max Planck Institute for Immunobiology and Epigenetics, Freiburg, Germany	156
abretaud	Anthony Bretaudeau	INRA, UMR IGEPP, BioInformatics Platform for Agroecosystems Arthropods (BIPAA), Campus Beaulieu, Rennes, France	151
lecorguille	Gildas Le Corguillé	UPMC, CNRS, FR2424, ABiMS, Station Biologique, Roscoff, France	150
cbrueffer	Christian Brueffer	Division of Oncology and Pathology, Department of Clinical Sciences, Lund University, Lund, Sweden	149
dyusuf	Dilmurat Yusuf	Bioinformatics Group, Department of Computer Science, University of Freiburg, Freiburg, Germany	145
sebastian-luna-valero	Sebastian Luna-Valero	MRC Weatherall Institute of Molecular Medicine, University of Oxford, Oxford, United Kingdom	140
roryk	Rory Kirchner	 Department of Biostatistics, Harvard T.H. Chan School of Public Health, Boston, United States	132
karel-brinda	Karel Brinda	Center for Communicable Disease Dynamics, Department of Epidemiology, Harvard TH Chan School of Public Health, Boston, United States	131
martin-mann	Martin Raden	Bioinformatics Group, Department of Computer Science, University of Freiburg, Freiburg, Germany	122
ThomasWollmann	Thomas Wollmann	University of Heidelberg and DKFZ, Heidelberg, Germany	121
simonvh	Simon J. van Heeringen	Radboud University, Faculty of Science, Department of Molecular Developmental Biology, Radboud Institute for Molecular Life Sciences, Nijmegen, The Netherlands	109
lpantano	Lorena Pantano	Harvard T.H. Chan School of Public Health, Boston, United States	109
nsoranzo	Nicola Soranzo	Earlham Institute, Norwich Research Park, Norwich, United Kindgom	109
zachcp	Zachary Charlop-Powers	The Laboratory for Genetically Encoded Small Molecules, The Rockefeller University, New York, United States	107
matthdsm	Matthias De Smet	Ghent University Hospital, Ghent University, Belgium	104
percyfal	Per Unneberg	Department of Cell and Molecular Biology, National Bioinformatics Infrastructure Sweden, Science for Life Laboratory, Uppsala University, Uppsala, Sweden	103
marcelm	Marcel Martin	Department of Biochemistry and Biophysics, National Bioinformatics Infrastructure Sweden, Science for Life Laboratory, Stockholm University, Sweden	91
gregvonkuster	Greg Von Kuster	Institute for CyberScience, Pennsylvania State University, University Park, United States	81
mmiladi	Milad Miladi	Bioinformatics Group, Department of Computer Science, University of Freiburg, Freiburg, Germany	71
tiagoantao	Tiago Antao	Division of Biological Sciences, University of Montana, Missoula, United States of America	67
mvdbeek	Marius van den Beek	Stem Cells and Tissue Homeostasis, Institut Curie, Paris, France	59
molpopgen	Kevin Thornton	Department of Ecology and Evolutionary Biology, University of California Irvine, Irvine, United States	58
dmaticzka	Daniel Maticzka	Bioinformatics Group, Department of Computer Science, University of Freiburg, Freiburg, Germany	56
blankclemens	Clemens Blank	Bioinformatics Group, Department of Computer Science, University of Freiburg, Freiburg, Germany	53
s-will	Sebastian Will	Institute for Theoretical Chemistry, University of Vienna, Vienna, Austria	50
keuv-grvl	Kévin Gravouil	Université Clermont Auvergne, INRA, MEDIS, Clermont-Ferrand, France	48
joachimwolff	Joachim Wolff	Bioinformatics Group, Department of Computer Science, University of Freiburg, Freiburg, Germany	44
holtgrewe	Manuel Holtgrewe	Core Unit Bioinformatics, Berlin Institute of Health, Berlin, Germany; Charité Universitätsmedizin Berlin, Berlin, Germany	43
pirovc	Vitor C. Piro	Bioinformatics Unit, Robert Koch Institute, Berlin, Germany; CAPES Foundation, Ministry of Education of Brazil, Brasília, Brazil	43
mbargull	Marcel Bargull	Genome Informatics, Institute of Human Genetics, University Hospital Essen, University of Duisburg-Essen, Essen, Germany	40
jfallmann	Jörg Fallmann	Bioinformatics Group, Department of Computer Science and Interdisciplinary Center for Bioinformatics, University of Leipzig, Leipzig, Germany	40
notestaff	Ilya Shlyakhter	Broad Institute of MIT and Harvard, Cambridge, United States	37
Takadonet	Philip Mabon	National Microbiology Laboratory, Public Health Agency of Canada, Winnipeg, Canada	36
aymanm	Ayman Yousif	Center for Genomics and System Biology, New York University, Abu Dhabi, United Arab Emirates	36
kepbod	Xiao-Ou Zhang	Program in Bioinformatics and Integrative Biology, University of Massachusetts Medical School, Worcester, United States	36
shenwei356	Wei Shen	Department of Clinical Laboratory, Chengdu Military General Hospital, Chengdu, China	35
JenCabral	Jennifer Cabral	National Microbiology Laboratory, Public Health Agency of Canada, Winnipeg, Canada	35
ericenns	Eric Enns	 National Microbiology Laboratory, Public Health Agency of Canada, Winnipeg, Canada	34
cristhomas	Cristel Thomas	 Northrop Grumman Corporation, Technology Services, Rockville, United States	34
brwnj	Joseph Brown	 Biological Sciences Division, Pacific Northwest National Laboratory, Richland, United States	34
jeromekelleher	Jerome Kelleher	Big Data Institute, Li Ka Shing Centre for Health Information and Discovery, University of Oxford, Oxford, United Kingdom	32
davebx	Dave Bouvier	Department of Biochemistry & Molecular Biology, Pennsylvania State University, University Park, United States	32
mdehollander	Mattias de Hollander	Netherlands Institute of Ecology (NIOO-KNAW), Wageningen, The Netherlands	32
glormph	Jorrit Boekel	Department of Oncology-Pathology, National Bioinformatics Infrastructure Sweden, Science for Life Laboratory, Karolinska Institutet, Solna, Sweden	32
nturaga	Nitesh Turaga	Department of Biology, Johns Hopkins University, Baltimore, United States	31
jrderuiter	Julian R. de Ruiter	Divisions of Molecular Pathology and Molecular Carcinogenesis, The Netherlands Cancer Institute, Amsterdam, The Netherlands	31
Slugger70	Simon Gladman	Melbourne Bioinformatics, University of Melbourne, Melbourne, Australia	31
hardingnj	Nicholas Harding	Big Data Institute, Li Ka Shing Centre for Health Information and Discovery, University of Oxford, Oxford, United Kingdom	30
saketkc	Saket Choudhary	Computational Biology and Bioinformatics, University of Southern California, Los Angeles, United States	30
eggzilla	Florian Eggenhofer	Bioinformatics Group, Department of Computer Science, University of Freiburg, Freiburg, Germany	29
asntech	Aziz Khan	Centre for Molecular Medicine Norway (NCMM), Nordic EMBL Partnership, University of Oslo, Oslo, Norway	27
BioNinja	Zhuoqing Fang	Shanghai Institutes for Biological Sciences, University of Chinese Academy of Sciences, Chinese Academy of Sciences, Shanghai, China	26
peterjc	Peter J. A. Cock	 The James Hutton Institute, Dundee, United Kingdom	26
ArneKr	Arne Kratz	Bioinformatics Research Centre, Aarhus University, Aarhus, Denmark	26
HenningTimm	Henning Timm	Genome Informatics, Institute of Human Genetics, University Hospital Essen, University of Duisburg-Essen, Essen, Germany	25
RobertKleinkauf	Robert Kleinkauf	-	25
endrebak	Endre Bakken Stovner	Department of Computer Science, Norwegian University of Science and Technology	21
hainm	Hai Nguyen	Department of Chemistry & Chemical Biology, Rutgers University, Piscataway, United States	21
eseiler	Enrico Seiler	Bioinformatics Unit, Robert Koch Institute, Berlin, Germany	21
chambm	Matt Chambers	Department of Biochemistry, Molecular Biology and Biophysics (as contractor, not employee), University of Minnesota, Minneapolis, United States	20
ewels	Philip Ewels	Department of Biochemistry and Biophysics, Science for Life Laboratory, Stockholm University, Stockholm, Sweden	20
colinbrislawn	Colin Brislawn	Earth and Biological Sciences Directorate, Pacific Northwest National Laboratory, Richland, United States	20
epruesse	Elmar Pruesse	University of Colorado, Denver, United States	20
jj-umn	James E. Johnson	Minnesota Supercomputing Institute, University of Minnesota, Minneapolis, United States	19
emilhaegglund	Emil Hägglund	Department of Molecular Evolution, Cell and Molecular Biology, Science for Life Laboratory, Biomedical Centre, Uppsala University, Uppsala, Sweden	19
brainstorm	Roman Valls Guimera	 Center for Cancer Research, University of Melbourne, Melbourne, Australia	18
lparsons	Lance Parsons	Lewis-Sigler Institute for Integrative Genomics, Princeton University, Princeton, United States	18
yesimon	Simon Ye	Massachusetts Institute of Technology, Cambridge, United States	18
rob-p	Rob Patro	Department of Computer Science, Stony Brook University, Stony Brook, United States	17
alexpreynolds	Alex Reynolds	Altius Institute for Biomedical Sciences, Seattle, United States	17
xguse	W. Augustine Dunn	Boston Children's Hospital, Boston, United States	17
NickSto	Nicholas Stoler	Department of Biochemistry and Molecular Biology, Pennsylvania State University, University Park, United States	17
vodkatad	Elena Grassi	Transcription and Chromatin Lab, Humanitas University, Rozzano, Italy	16
mcornwell1957	MacIntosh Cornwell	New York University School of Medicine, New York City, United States	16
dkoppstein	David Koppstein	The Kirby Institute of Infection and Immunity, University of New South Wales, Sydney, Australia	16
iwohlers	Inken Wohlers	Lübeck Interdisciplinary Platform for Genome Analytics (LIGA), Institutes of Neurogenetics and Integrative Experimental Genomics, University of Lübeck, Lübeck, Germany	16
blankenberg	Daniel Blankenberg	Genomic Medicine Institute, Lerner Research Institute, Cleveland Clinic, Cleveland, United States	15
guowei-he	Guowei He	High Performance Computing, NYU Abu Dhabi, Abu Dhabi, United Arab Emirates	14
JungeAlexander	Alexander Junge	Disease Systems Biology Program, Novo Nordisk Foundation Center for Protein Research, University of Copenhagen, Copenhagen, Denmark	13
rfarouni	Rick Farouni	Massachusetts General Hospital and Harvard Medical School, Boston, United States	13
malloryfreeberg	Mallory Freeberg	 EMBL-EBI, Wellcome Genome Campus, Hinxton, Cambridgeshire, United Kingdom	13
sahilseth	Sahil Seth	Institute of Applied Cancer Science, MD Anderson Cancer Center, Houston, United States	12
souravsingh	Sourav Singh	Savitribai Phule Pune University, Pune, Maharashtra, India	12
bogemad	Daniel R. Bogema	NSW Department of Primary Industries, Elizabeth Macarthur Agricultural Institute, Menangle, Australia	12
nickp60	Nicholas R. Waters	Department of Microbiology, School of Natural Sciences, National University of Ireland, Galway, Ireland Information and Computational Sciences, James Hutton Institute, Invergowrie, Scotland	12
ernfrid	David E Larson	The McDonnell Genome Institute, Washington University, St. Louis, United States	12
Cashalow	Sacha Laurent	 Institute of Microbiology, Universitary Hospital of Lausanne, Switzerland	11
ccwang002	Liang-Bo Wang	Oncology Division, Department of Medicine, Washington University School of Medicine, St. Louis, United States; McDonnell Genome Institute, Washington University School of Medicine, St. Louis, United States	11
fabio-cumbo	Fabio Cumbo	"Department of Engineering, Roma Tre University, Rome, Italy; Institute for Systems Analysis and Computer Science ""Antonio Ruberti"", National Research Council of Italy, Rome, Italy; Department of Biochemistry and Molecular Biology, Pennsylvania State University, University Park, United States; SYSBIO.IT Center for Systems Biology, Milan, Italy"	11
dlaehnemann	David Laehnemann	Computational Biology of Infection Research Group, Helmholtz Centre for Infection Research, Braunschweig, Germany; Department of Paediatric Oncology, Haematology and Immunology, Heinrich Heine University Hospital, Düsseldorf, Germany	10
mworkentine	Matthew L. Workentine	Faculty of Veterinary Medicine, University of Calgary, Calgary, Canada	10
upendrak	Upendra Kumar Devisetty	CyVerse, Bio5 institute, University of Arizona, Tucson, United States	9
jamesabbott	James Abbott	Department of Surgery and Cancer, Imperial College, London, United Kingdom	9
ar0ch	Aroon T. Chande	Applied Bioinformatics Laboratory, 2 Ravinia Drive, Suite 1200 Atlanta, GA 30346, United States	8
pkrog	Pierrick Roger	CEA, LIST, Laboratory for data analysis and systems' intelligence, MetaboHUB, France	7
tobiasrausch	Tobias Rausch	European Molecular Biology Laboratory (EMBL), Genomics Core Facility, Heidelberg, Germany	7
rasmusagren	Rasmus Agren	Department of Biology and Biological Engineering, National Bioinformatics Infrastructure Sweden, Science for Life Laboratory, Chalmers University of Technology, Sweden	7
jmeppley	John M Eppley	Daniel K. Inouye Center for Microbial Oceanography: Research and Education, Department of Oceanography, University of Hawaii, Honolulu, United States	7
xgaia	Xavier Garnier	INRA, UMR IGEPP, BioInformatics Platform for Agroecosystems Arthropods (BIPAA), Campus Beaulieu, Rennes, France; Dyliss - Dynamics, Logics and Inference for biological Systems and Sequences, Inria/IRISA, Campus Beaulieu, Rennes, France	7
davidliwei	Wei Li	Center for Genetic Medicine Research, Children's National Medical Center, Department of Genomics and Precision Medicine, George Washington University, Washington DC, United States	6
jxtx	James Taylor	 Departments of Biology and Computer Science, Johns Hopkins University, Baltimore, United States	6
BiancaStoecker	Bianca Katharina Stöcker	Genome Informatics, Institute of Human Genetics, University Hospital Essen, University of Duisburg-Essen, Essen, Germany	6
davidechicco	Davide Chicco	Princess Margaret Cancer Centre, Toronto, Canada	6
jbaaijens	Jasmijn A. Baaijens	Centrum Wiskunde and Informatica, Amsterdam, Netherlands	5
imilne	Iain Milne	The James Hutton Institute, Dundee, United Kingdom	5
Adamtaranto	Adam P. Taranto	Plant Sciences Division, Research School of Biology, The Australian National University, Canberra, Australia	5
nvictus	Nezar Abdennur	Massachusetts Institute of Technology, Cambridge, United States	5
jenzopr	Jens Preussner	ECCPS Bioinformatics Core Unit, Max Planck Institute for Heart and Lung Research, Bad Nauheim, Germany	5
PatrickRWright	Patrick R. Wright	Bioinformatics Group, Department of Computer Science, University of Freiburg, Freiburg, Germany	5
bsennblad	Bengt Sennblad	Department of Cell and Molecular Biology, National Bioinformatics Infrastructure Sweden, Science for Life Laboratory, Uppsala University, Uppsala, Sweden	5
oena	Oana M. Enache	Broad Institute of MIT and Harvard, Cambridge, United States	5
hellothisisMatt	Matthew Gopez	 National Microbiology Laboratory, Public Health Agency of Canada, Winnipeg, Canada	5
micknudsen	Michael Knudsen	 Department of Molecular Medicine, Aarhus University Hospital, Aarhus, Denmark	4
vinjana	Philip Reiner Kensche	German Cancer Research Center (DKFZ), Foundation under Public Law, Heidelberg, Germany	4
inodb	Ino de Bruijn	Department of Pathology, Memorial Sloan Kettering Cancer Center, New York, United States	4
kblin	Kai Blin	The Novo Nordisk Foundation Center for Biosustainability, Technical University of Denmark, Lyngby, Denmark	4
k3yavi	Avi Srivastava	Department of Computer Science, Stony Brook University, Stony Brook, United States	4
yp	Yuri Pirola	Dip. di Informatica Sistemistica e Comunicazione, Univ. degli Studi di Milano-Bicocca, Milan, Italy	4
lucapinello	Luca Pinello	Massachusetts General Hospital and Harvard Medical School, Boston, United States	4
ggonnella	Giorgio Gonnella	ZBH - Center for Bioinformatics, MIN-Fakultät, Universität Hamburg, Hamburg, Germany	3
camytran	Camy Tran	 National Microbiology Laboratory, Public Health Agency of Canada, Winnipeg, Canada	3
christofsteel	Christoph Stahl	Genome Informatics, Institute of Human Genetics, University Hospital Essen, University of Duisburg Essen, Essen, Germany	3
shiltemann	Saskia Hiltemann	Erasmus Medical Center, Rotterdam, The Netherlands	3
alimanfoo	Alistair Miles	Big Data Institute, Li Ka Shing Centre for Health Information and Discovery, University of Oxford, Oxford, United Kingdom	3
raivivek	Vivek Rai	Department of Computational Medicine and Bioinformatics, University of Michigan, Ann Arbor, United States	3
OvoiDs	Yannick Boursin	Institut Gustave Roussy, Villejuif, France	3
mlbendall	Matthew L. Bendall	Computational Biology Institute, Milken Institute School of Public Health, The George Washington University, Washington, D.C., United States; Department of Microbiology, Immunology & Tropical Medicine, The George Washington University School of Medicine and Health Sciences, Washington, D.C., United States	3
sschmeier	Sebastian Schmeier	Massey University, Institute of Natural and Mathematical Sciences, North Shore City, New Zealand	2
arvkevi	Kevin Arvai	GeneDx, Gaithersburg, United States	2
ypriverol	Yasset Perez-Riverol	European Molecular Biology Laboratory, European Bioinformatics Institute, Wellcome Trust Genome Campus , Hinxton, Cambridge, United Kingdom	2
dirmeier	Simon Dirmeier	Department of Biosystems Science and Engineering, ETH Zurich, Basel, Switzerland	2
matthieujung	Matthieu Jung	Institut de Génétique et de Biologie Moléculaire et Cellulaire, CNRS, Illkirch, France	2
eclarke	Erik Clarke	Department of Microbiology, University of Pennsylvania, United States	2
gurgese	Gianvito Urgese	Department of Control and Computer Engineering, Politecnico di Torino, Torino, Italy	2
julozi	Julien Seiler	Institut de Génétique et de Biologie Moléculaire et Cellulaire, CNRS, Illkirch, France	1
mikheyev	Alexander S Mikheyev	Evolutionary Genomics Lab, Research School of Biology, The Australian National University, Canberra, Australia; Ecology and Evolution Unit, Okinawa Institute of Science and Technology Graduate University, Onna-son, Kunigami-gun, Okinawa, Japan	1
luispedro	Luis Pedro Coelho	Structural and Computational Biology Unit, European Molecular Biology Laboratory, Heidelberg, Germany	1
dbeisser	Daniela Beisser	Biodiversity, Faculty of Biology, University of Duisburg-Essen, Essen, Germany	1
jcapelladesto	Jordi Capellades	Metabolomics Platform, Department of Electronic Engineering (DEEEA), Universitat Rovira i Virgili, Tarragona, Spain; Biomedical Research Centre in Diabetes and Associated Metabolic Disorders (CIBERDEM), Madrid, Spain	1
moskalenko	Oleksandr Moskalenko	UFIT Research Computing, University of Florida, Gainesville, United States	1
svenrahmann	Sven Rahmann	Genome Informatics, Institute of Human Genetics, University of Duisburg-Essen, University Hospital Essen, Essen, Germany	1
joshmoore	Josh Moore	Centre for Gene Regulation & Expression & Division of Computational Biology, University of Dundee, Dundee, United Kingdom	1
gordonstephen	Gordon Stephen	The James Hutton Institute, Dundee, United Kingdom	1
thw17	Timothy H. Webster	School of Life Sciences, Arizona State University, Tempe, United States	1
christopher-schroeder	Christopher Schröder	Genome Informatics, Institute of Human Genetics, University of Duisburg-Essen, Essen, Germany	1
Adrianzo	Adrian Emanuel Salatino	Department of Molecular Genetics and Biology of Complex Diseases, Institute of Medical Research A Lanari-IDIM, University of Buenos Aires, National Scientific and Technical Research Council (CONICET), Ciudad Autónoma de Buenos Aires, Argentina.	1
tdido	Tomás Di Domenico	 Wellcome Trust Sanger Institute, Wellcome Trust Genome Campus, United Kingdom	1
khourhin	Etienne Kornobis	Epigenetic Regulation Unit, Pasteur Institute, Paris, France	1
erasche	Eric Rasche	Bioinformatics Group, Department of Computer Science, University of Freiburg, Freiburg, Germany	1
fabianomenegidio	Fabiano Bezerra Menegidio	Núcleo Integrado de Biotecnologia, Universidade de Mogi das Cruzes (UMC), Mogi das Cruzes, Brazil	0
MarziaCremona	Marzia A. Cremona	Department of Statistics, Pennsylvania State University, University Park, United States	0
aldro61	Alexandre Drouin	Department of Computer Science and Software Engineering, Université Laval, Québec, Canada	0
amcooksey	Amanda M. Cooksey	CyVerse, BIO5 Institute, University of Arizona, Tucson, United States	0
FrodePedersen	Frode Pedersen	Bioinformatics Research Centre, Aarhus University, Aarhus, Denmark	0
dansondergaard	Dan Søndergaard	Bioinformatics Research Centre, Aarhus University, Aarhus, Denmark	0
greed2411	Jaivarsan B	Department of Computer Science, Computer science with specialisation in Bioinformatics, VIT University Vellore, India	0
liyawang	Liya Wang	 Cold Spring Harbor Laboratory, Cold Spring Harbor, United States	0
fgiacomoni	Franck Giacomoni	Clermont Auvergne University, INRA, UNH, Human Nutrition Unit, PFEM, Metabolism Exploration Platform, MetaboHUB-Clermont, Clermont-Ferrand, France	0
arose	Alexander S Rose	RCSB Protein Data Bank, San Diego Supercomputer Center, University of California, San Diego, United States	0
prvst	Felipe da Veiga Leprevost	Pathology Department, University of Michigan, Ann Arbor, United States	0
snewhouse	Stephen J. Newhouse	Department of Biostatistics and Health Informatics, Institute of Psychiatry, Psychology and Neuroscience, King’s College London, London, United Kingdom; NIHR Biomedical Research Centre at South London and Maudsley NHS Foundation Trust and King’s College London, United Kingdom; Farr Institute of Health Informatics Research, UCL Institute of Health Informatics, University College London, London, United Kingdom	0
JudoWill	Will Dampier	Drexel University College of Medicine, Department of Microbiology and Immunology, Philadelphia, United States	0
johanneskoester	Johannes Köster	Algorithms for reproducible bioinformatics, Genome Informatics, Institute of Human Genetics, University Hospital Essen, University of Duisburg-Essen; Dana Farber Cancer Institute, Harvard Medical School, Boston, United States	1251
